{
  "schema": "omnikali.environment/v1",
  "kind": "grasshopper-workstation",
  "version": "1.0.0",
  "execution": { "interactive": true, "persistent": true, "privileged_android_shell": false },
  "control": { "screen": true, "input": true, "adb": true, "human_gate": true },
  "parameters": { "state_dir": "~/.grasshopper", "preferred_transport": "rdc" }
}
