{
  "schema": "omnikali.environment/v1",
  "kind": "physical-android",
  "version": "1.0.0",
  "execution": { "interactive": true, "persistent": false, "privileged_android_shell": false },
  "control": { "screen": true, "input": true, "adb": true, "human_gate": true, "bidirectional": true },
  "parameters": { "transport": "rdc+termux+rish+shizuku", "execution_adapter": "broccoli-core" }
}
